{"artifact_id":"figure.loop.grid","artifact_kind":"figure_composition","encodings":[{"color":"#0072B2","label":"Sample","line_style":"solid","semantic_id":"sample","shape":"circle"},{"color":"#D55E00","label":"Analysis","line_style":"dashed","semantic_id":"analysis","shape":"diamond"},{"color":"#009E73","label":"Exit","line_style":"dotted","semantic_id":"exit","shape":"square"}],"height_mm":330.0,"layout":{"axes":"independent","column_ratios":[1,1],"gap_pt":12,"kind":"grid","row_ratios":[1,2]},"legend_ids":["sample","analysis","exit"],"panels":[{"claims":[],"content_kind":"sequence","content_ref":{"artifact_id":"evidence.synthetic","binding_id":"binding.0","json_pointer":"/sequence","ledger_event_id":"evt-00000000-0000-4000-8000-000000000002","ledger_event_sha256":"1c5ff0dc6b3792c042e92511330c885cbea30cb9adb393e4df69050c74c24935","sha256":"a5c5776aae0835005d5625954953c53b224a7bb893676a2ea9e525ef6b1beb70"},"content_sha256":"be08163c6ac1648818e2094d46d36154315a8bfaf8785290fb0ba0e28c053813","label":"a","panel_id":"panel.0","position":{"align":"center","column":0,"column_span":1,"row":0,"row_span":1},"reading_order":1,"renderer":{"identity_digest":"9280a6bf32af5daf80b65c069f8ae8b82d26ee1e42e2dd4f588fdad85696a8c8","name":"arw.composition-svg","normalization_policy":"utf8-svg-bounded-cells-uniform6.v1","version":"1.0.0"},"role":"schematic","title":"Observed source"},{"claims":[],"content_kind":"entity_graph","content_ref":{"artifact_id":"evidence.synthetic","binding_id":"binding.1","json_pointer":"/loop_control","ledger_event_id":"evt-00000000-0000-4000-8000-000000000002","ledger_event_sha256":"1c5ff0dc6b3792c042e92511330c885cbea30cb9adb393e4df69050c74c24935","sha256":"a5c5776aae0835005d5625954953c53b224a7bb893676a2ea9e525ef6b1beb70"},"content_sha256":"de67340c61e5e71c84e75a44d7fdc59a6145e2a3cfbad798d20ac91a3764b213","label":"b","panel_id":"panel.1","position":{"align":"center","column":1,"column_span":1,"row":0,"row_span":1},"reading_order":2,"renderer":{"identity_digest":"9280a6bf32af5daf80b65c069f8ae8b82d26ee1e42e2dd4f588fdad85696a8c8","name":"arw.composition-svg","normalization_policy":"utf8-svg-bounded-cells-uniform6.v1","version":"1.0.0"},"role":"schematic","title":"Conditional control loop"},{"claims":[],"content_kind":"entity_graph","content_ref":{"artifact_id":"evidence.synthetic","binding_id":"binding.2","json_pointer":"/loop_data","ledger_event_id":"evt-00000000-0000-4000-8000-000000000002","ledger_event_sha256":"1c5ff0dc6b3792c042e92511330c885cbea30cb9adb393e4df69050c74c24935","sha256":"a5c5776aae0835005d5625954953c53b224a7bb893676a2ea9e525ef6b1beb70"},"content_sha256":"ed1f31f83b5a104e7088485f769b6575efb0d7d7084bd71add0f329281c93eb1","label":"c","panel_id":"panel.2","position":{"align":"center","column":0,"column_span":2,"row":1,"row_span":1},"reading_order":3,"renderer":{"identity_digest":"9280a6bf32af5daf80b65c069f8ae8b82d26ee1e42e2dd4f588fdad85696a8c8","name":"arw.composition-svg","normalization_policy":"utf8-svg-bounded-cells-uniform6.v1","version":"1.0.0"},"role":"schematic","title":"Distinct data flow"}],"publication_critical":false,"renderer_hints":{"identity_digest":"9280a6bf32af5daf80b65c069f8ae8b82d26ee1e42e2dd4f588fdad85696a8c8","name":"arw.composition-svg","normalization_policy":"utf8-svg-bounded-cells-uniform6.v1","version":"1.0.0"},"revision":1,"schema_version":"arw.figure-composition-ir.v1","supersedes":null,"validation_policy":{"provenance":"REQUIRED","render":"REQUIRED","schema":"REQUIRED","semantic":"REQUIRED","visual":"OPTIONAL"},"visual_argument":"Input starts analysis; completion exits, otherwise control returns; data flow is distinct.","width_mm":180.0}
