{"artifact_id":"figure.mixed.column","artifact_kind":"figure_composition","encodings":[{"color":"#0072B2","label":"Sample","line_style":"solid","semantic_id":"sample","shape":"circle"},{"color":"#D55E00","label":"Analysis","line_style":"dashed","semantic_id":"analysis","shape":"diamond"},{"color":"#009E73","label":"Exit","line_style":"dotted","semantic_id":"exit","shape":"square"}],"height_mm":330.0,"layout":{"axes":"independent","column_ratios":[1],"gap_pt":12,"kind":"column","row_ratios":[1,2,3]},"legend_ids":["sample","analysis","exit"],"panels":[{"claims":[],"content_kind":"sequence","content_ref":{"artifact_id":"evidence.synthetic","binding_id":"binding.0","json_pointer":"/sequence","ledger_event_id":"evt-00000000-0000-4000-8000-000000000002","ledger_event_sha256":"1c5ff0dc6b3792c042e92511330c885cbea30cb9adb393e4df69050c74c24935","sha256":"a5c5776aae0835005d5625954953c53b224a7bb893676a2ea9e525ef6b1beb70"},"content_sha256":"be08163c6ac1648818e2094d46d36154315a8bfaf8785290fb0ba0e28c053813","label":"a","panel_id":"panel.0","position":{"align":"center","column":0,"column_span":1,"row":0,"row_span":1},"reading_order":1,"renderer":{"identity_digest":"9280a6bf32af5daf80b65c069f8ae8b82d26ee1e42e2dd4f588fdad85696a8c8","name":"arw.composition-svg","normalization_policy":"utf8-svg-bounded-cells-uniform6.v1","version":"1.0.0"},"role":"schematic","title":"Observed source"},{"claims":[],"content_kind":"entity_graph","content_ref":{"artifact_id":"evidence.synthetic","binding_id":"binding.1","json_pointer":"/mechanism","ledger_event_id":"evt-00000000-0000-4000-8000-000000000002","ledger_event_sha256":"1c5ff0dc6b3792c042e92511330c885cbea30cb9adb393e4df69050c74c24935","sha256":"a5c5776aae0835005d5625954953c53b224a7bb893676a2ea9e525ef6b1beb70"},"content_sha256":"19da861e4064c9d6c4bf4a2f8fb73437c7650fa5d41d8bca915569a3587d6856","label":"b","panel_id":"panel.1","position":{"align":"center","column":0,"column_span":1,"row":1,"row_span":1},"reading_order":2,"renderer":{"identity_digest":"9280a6bf32af5daf80b65c069f8ae8b82d26ee1e42e2dd4f588fdad85696a8c8","name":"arw.composition-svg","normalization_policy":"utf8-svg-bounded-cells-uniform6.v1","version":"1.0.0"},"role":"schematic","title":"Bound representation"},{"claims":[],"content_kind":"accepted_v1","content_ref":{"artifact_id":"figure.exact","binding_id":"binding.2","json_pointer":"","ledger_event_id":"evt-00000000-0000-4000-8000-000000000004","ledger_event_sha256":"3a0e666e291b179be7553cbda27d27364bb117abc5447a88ff63b467a5983dd6","sha256":"ea48030eacb6e8db4fd58dcfe25ef0423efbe71006334dc2fa94bdfcd838c7fb"},"content_sha256":"ea48030eacb6e8db4fd58dcfe25ef0423efbe71006334dc2fa94bdfcd838c7fb","label":"c","panel_id":"panel.2","position":{"align":"center","column":0,"column_span":1,"row":2,"row_span":1},"reading_order":3,"renderer":{"identity_digest":"20b5a079eaf136a8fa21f7db968499aabdbb55c66af599982982b3a026528439","name":"arw.result-svg","normalization_policy":"utf8-lf-exact-fraction-decimal400-log-layout6-tick-significant.v2","version":"1.0.0"},"role":"quantitative","title":"Accepted exact evidence"}],"publication_critical":false,"renderer_hints":{"identity_digest":"9280a6bf32af5daf80b65c069f8ae8b82d26ee1e42e2dd4f588fdad85696a8c8","name":"arw.composition-svg","normalization_policy":"utf8-svg-bounded-cells-uniform6.v1","version":"1.0.0"},"revision":1,"schema_version":"arw.figure-composition-ir.v1","supersedes":null,"validation_policy":{"provenance":"REQUIRED","render":"REQUIRED","schema":"REQUIRED","semantic":"REQUIRED","visual":"OPTIONAL"},"visual_argument":"The same observed sample has a bound representation and exact accepted numeric evidence.","width_mm":180.0}
